{
    "caseId":  "EXP-023",
    "timestamp":  "2026-08-29T16:54:58.3936440-03:00",
    "baselineCommit":  "8316d9ffa0c109c0aac68fd181b94fdd9dce368e",
    "durationMs":  27092,
    "testCommand":  "mvn -Dmaven.repo.local=\u003clocal-repository\u003e -Dspring.datasource.url=jdbc:h2:file:\u003ctemporary-primary-db\u003e;DB_CLOSE_ON_EXIT=FALSE -Dspring.jpa.hibernate.ddl-auto=update -Dtest=BookApiIntegrationTest#testCreateBook_Snapshot test",
    "testExitCode":  1
}
