{
    "caseId":  "EXP-030",
    "timestamp":  "2026-08-30T13:29:35-03:00",
    "baselineCommit":  "8316d9ffa0c109c0aac68fd181b94fdd9dce368e",
    "durationMs":  29613,
    "testCommand":  "mvn -Dmaven.repo.local=\u003clocal-repository\u003e -Dspring.datasource.url=jdbc:h2:file:\u003ctemporary-primary-db\u003e -Dspring.jpa.hibernate.ddl-auto=update -Dtest=BookApiIntegrationTest#testGetBooksByAuthor_Snapshot test",
    "testExitCode":  1
}
